{
  "schema_version": 1,
  "kind": "pap-run-manifest",
  "run_id": "20260724_08e8e9591_multi_pa_deferred_c12_s16_t4",
  "experiment_id": "PAP-20260724-MULTI-PA-FANIN-TRACE",
  "profile_id": "aiperf_qwen3_8b_4gpu_o32",
  "architecture": "pap",
  "mode": "diagnostic",
  "evidence": "diagnostic",
  "provenance": {
    "branch": "feature/pap",
    "commit": "08e8e9591302636a834f9398db54d4acddc87826",
    "tracked_worktree_dirty": false,
    "tracked_worktree_patch_sha256": "e3b0c44298fc1c149afbf4c8996fb92427ae41e4649b934ca495991b7852b855",
    "tracked_index_patch_sha256": "e3b0c44298fc1c149afbf4c8996fb92427ae41e4649b934ca495991b7852b855",
    "started_at": "2026-07-24T22:21:48+08:00"
  },
  "workload": {
    "model": {
      "path": "missing",
      "dtype": "float16",
      "tensor_parallel_size": 1
    },
    "corpus": {
      "path": "missing",
      "sha256": "missing"
    },
    "parameters": {
      "client": "aiperf-0.11.0",
      "sessions": 16,
      "turns": 4,
      "requests": 64,
      "concurrency": 12,
      "initial_input_mean_tokens": 8192,
      "append_input_mean_tokens": 512,
      "output_mean_tokens": 32,
      "think_time_ms": 3000,
      "tool_time_ms": 1000
    }
  },
  "topology": {
    "name": "3pa1p",
    "pa_count": 3,
    "projection_count": 1,
    "pd_prefill_count": 0,
    "pd_decode_count": 0,
    "routing_policy": "conversation_affinity"
  },
  "placement": {
    "prefill_devices": [0, 1, 2],
    "attention_devices": [0, 1, 2],
    "projection_devices": [3],
    "decode_devices": []
  },
  "transport": {
    "offload_exec": "local_fast",
    "offload_kv": "cuda_ipc",
    "same_host": true
  },
  "mps": {
    "mode": "static",
    "profile_id": "static_72_20",
    "prefill_visible_sms": 72,
    "attention_visible_sms": 20
  },
  "runtime": {
    "profile": "deferred_multi_pa_fanin_trace",
    "settings": {
      "offload_exec_trace": false,
      "deferred_cuda_trace": true,
      "deferred_trace_max_pending": 4096,
      "projection_async_scheduling": true,
      "projection_runner_microbatch_pipeline": false,
      "direct_mailbox_output": true
    }
  },
  "environment": {
    "hardware_signature": "4x NVIDIA L20",
    "software": {
      "aiperf": "0.11.0",
      "vllm_commit": "08e8e9591302636a834f9398db54d4acddc87826"
    },
    "fingerprint_basis": [
      "runtime commit",
      "AIPerf input",
      "trace configuration"
    ]
  },
  "fingerprints": {
    "profile": "missing",
    "implementation": "missing",
    "request_shape": "missing",
    "hardware_runtime": "missing"
  },
  "repetitions": {
    "count": 1,
    "order": [1],
    "aggregation_method": "single diagnostic run",
    "items": [
      {
        "index": 1,
        "repetition_id": "deferred-cuda-trace",
        "result_artifact": {
          "root_id": "pap-worktree",
          "relative_path": "benchmarks/pap/experiments/PAP-20260724-MULTI-PA-FANIN-TRACE/report.md"
        }
      }
    ]
  },
  "audits": {
    "client": {
      "status": "passed",
      "detail": "AIPerf completed 64 of 64 requests with zero errors.",
      "evidence": [
        {
          "root_id": "pap-worktree",
          "relative_path": "benchmarks/pap/experiments/PAP-20260724-MULTI-PA-FANIN-TRACE/report.md"
        }
      ]
    },
    "attention_stats": {
      "status": "passed",
      "detail": "Captured 25,056 Projection layer calls and 44,280 peer-batches with no pending, dropped, or errored records.",
      "evidence": [
        {
          "root_id": "pap-worktree",
          "relative_path": "benchmarks/pap/experiments/PAP-20260724-MULTI-PA-FANIN-TRACE/runs/20260724_08e8e9591_multi_pa_deferred_c12_s16_t4/raw/projection_deferred_trace_0.json"
        }
      ]
    }
  },
  "metrics": {
    "completed_requests": 64,
    "failed_requests": 0,
    "values": [
      {
        "name": "projection_join_wait_p50_ms",
        "scope": "multi-pa-layer",
        "statistic": "p50",
        "unit": "ms",
        "value": 0.2549760043621063
      },
      {
        "name": "projection_join_wait_p90_ms",
        "scope": "multi-pa-layer",
        "statistic": "p90",
        "unit": "ms",
        "value": 0.3758080005645752
      },
      {
        "name": "output_scatter_p50_ms",
        "scope": "peer-layer",
        "statistic": "p50",
        "unit": "ms",
        "value": 0.004095999989658594
      }
    ]
  },
  "artifacts": [
    {
      "name": "report",
      "kind": "aggregate",
      "path": {
        "root_id": "pap-worktree",
        "relative_path": "benchmarks/pap/experiments/PAP-20260724-MULTI-PA-FANIN-TRACE/report.md"
      },
      "sha256": "20673a3dacb2b6026af9285f6c6660cba059c14323e752c9b8a3c05c4cbfc377"
    },
    {
      "name": "projection-deferred-trace",
      "kind": "trace",
      "path": {
        "root_id": "pap-worktree",
        "relative_path": "benchmarks/pap/experiments/PAP-20260724-MULTI-PA-FANIN-TRACE/runs/20260724_08e8e9591_multi_pa_deferred_c12_s16_t4/raw/projection_deferred_trace_0.json"
      },
      "sha256": "89243f83eb300092ab8d7eac5ec0eebf0c218cef0a86495edc5e214a5efeb11b"
    },
    {
      "name": "attention-deferred-trace",
      "kind": "metrics",
      "path": {
        "root_id": "pap-worktree",
        "relative_path": "benchmarks/pap/experiments/PAP-20260724-MULTI-PA-FANIN-TRACE/runs/20260724_08e8e9591_multi_pa_deferred_c12_s16_t4/raw/attention_fast_path_stats.json"
      },
      "sha256": "b1e45f9b4bb28b6c7f1b615b9b964f451567fa74abcc53f753d47d2a6e49475a"
    },
    {
      "name": "aiperf-profile",
      "kind": "profile",
      "path": {
        "root_id": "pap-worktree",
        "relative_path": "benchmarks/pap/experiments/PAP-20260724-MULTI-PA-FANIN-TRACE/runs/20260724_08e8e9591_multi_pa_deferred_c12_s16_t4/raw/aiperf/profile.json"
      },
      "sha256": "fac8c55c55b9b404de7b5fefb91f99a8517e40cded05e9da70f8dabba07f06e9"
    }
  ],
  "validity": {
    "status": "passed",
    "reasons": [
      "The original wrapper exited after a stale doorbell-span validation check; the captured trace was subsequently validated with the corrected multi-PA descriptorless contract."
    ]
  },
  "failure_reasons": []
}
