{
  "schema_version": 1,
  "kind": "pap-run-manifest",
  "run_id": "20260715_e5a6711f0_paged_fa_full92_diagnostic",
  "experiment_id": "PAP-20260715-PAGED-FA-SM-PROBE",
  "profile_id": "paged_fa_sm_probe",
  "architecture": "pap",
  "mode": "diagnostic",
  "evidence": "diagnostic",
  "provenance": {
    "branch": "feature/pap",
    "commit": "e5a6711f02ece26052cf2ec787303eed4d60b93f",
    "tracked_worktree_dirty": false,
    "tracked_worktree_patch_sha256": "e3b0c44298fc1c149afbf4c8996fb92427ae41e4649b934ca495991b7852b855",
    "tracked_index_patch_sha256": "e3b0c44298fc1c149afbf4c8996fb92427ae41e4649b934ca495991b7852b855",
    "started_at": "2026-07-15T22:14:31+08:00"
  },
  "workload": {
    "model": {
      "path": "missing",
      "dtype": "float16",
      "tensor_parallel_size": 1
    },
    "corpus": {
      "path": "missing",
      "sha256": "missing"
    },
    "parameters": {
      "workload_semantics": "standalone_matched_shape_paged_flash_attention",
      "batch_size": 3,
      "sequence_lengths": [17344, 17334, 17324],
      "num_query_heads": 32,
      "num_kv_heads": 8,
      "head_dim": 128,
      "block_size": 16,
      "table_blocks": 1092,
      "cross_layer_cache_layers": 36,
      "logical_min_kv_bytes": 213000192,
      "warmup_calls": 108,
      "timing_samples": 9,
      "calls_per_sample": 180,
      "gpu_metric_frequency_hz": 10000,
      "gpu_metric_duration_seconds": 1
    }
  },
  "topology": {
    "name": "standalone_attention_probe",
    "pa_count": 0,
    "projection_count": 0,
    "pd_prefill_count": 0,
    "pd_decode_count": 0,
    "routing_policy": "none"
  },
  "placement": {
    "prefill_devices": [],
    "attention_devices": [3],
    "projection_devices": [],
    "decode_devices": []
  },
  "transport": {
    "offload_exec": "none",
    "offload_kv": "none",
    "same_host": true
  },
  "mps": {
    "mode": "disabled",
    "profile_id": "full92",
    "prefill_visible_sms": "missing",
    "attention_visible_sms": 92
  },
  "runtime": {
    "profile": "paged_fa_p17_c4_full92",
    "settings": {
      "pap_services_launched": false,
      "fa_version": 2,
      "num_splits_argument": 0,
      "visible_sms": 92,
      "nsys_gpu_metrics_set": 5,
      "ncu_under_mps": false
    }
  },
  "environment": {
    "hardware_signature": "NVIDIA L20 SM89",
    "software": {
      "vllm": "0.23.1rc1.dev678+g4a7737647",
      "torch": "2.11.0+cu130",
      "cuda_runtime": "13.0",
      "cuda_driver": "595",
      "nsys": "2022.4.2",
      "ncu": "2022.4.1"
    },
    "fingerprint_basis": [
      "probe_shape",
      "probe_implementation",
      "hardware_signature",
      "software_versions",
      "sm_placement"
    ]
  },
  "fingerprints": {
    "profile": "8ad3b9c8e51cd3d812c82f674afdb99a6cea49910dc2e0c999f0832cb00f013e",
    "implementation": "79ff20e0635ba5a2ffff761c5b12829cffafacbd31a2d86d804f5cf1725277ba",
    "request_shape": "6fe99aa02e219ebe1cdba507ddb3989b2ce3c662fc3cde4dbf4d8e5c9942d0d0",
    "hardware_runtime": "d878a6200e87578c83d62aa2f88c5e89be3b04e92ba45e153cbfcdc5fb695b3e"
  },
  "repetitions": {
    "count": 1,
    "order": [1],
    "aggregation_method": "Nine CUDA-event samples of 180 calls and one second of 10 kHz NVTX-scoped GPU metrics.",
    "items": [
      {
        "index": 1,
        "repetition_id": "content_sha256:bc11e66f8aa76f11dc02986376e8166b02aec3e72ec5aa21a20ae4ab3c20c3d3",
        "result_artifact": {
          "root_id": "pap-worktree",
          "relative_path": "test/baseline/pap/results/runs/20260715_paged_fa_sm_probe_gpu3/summary.json"
        }
      }
    ]
  },
  "audits": {
    "client": {"status": "not-applicable", "detail": "No serving client is launched.", "evidence": []},
    "cache": {"status": "not-applicable", "detail": "No service cache semantics are exercised.", "evidence": []},
    "attention_stats": {
      "status": "passed",
      "detail": "Timing, GPU metrics, and full-SM NCU launch geometry are present.",
      "evidence": [
        {
          "root_id": "pap-worktree",
          "relative_path": "test/baseline/pap/results/runs/20260715_paged_fa_sm_probe_gpu3/summary.json"
        }
      ]
    },
    "correctness": {"status": "not-applicable", "detail": "P17 E2E remains the correctness gate.", "evidence": []},
    "decode_token_join": {"status": "not-applicable", "detail": "No PAP lifecycle is launched.", "evidence": []},
    "routing": {"status": "not-applicable", "detail": "No PAP routing is launched.", "evidence": []},
    "commit": {"status": "not-applicable", "detail": "No PAP commit path is launched.", "evidence": []},
    "lease": {"status": "not-applicable", "detail": "No PAP lease is created.", "evidence": []},
    "session_drain": {"status": "not-applicable", "detail": "No PAP session is created.", "evidence": []},
    "mps": {"status": "not-applicable", "detail": "The baseline exposes the full GPU without MPS.", "evidence": []}
  },
  "metrics": {
    "completed_requests": 0,
    "failed_requests": 0,
    "values": [
      {"name": "paged_fa_time_ms", "scope": "auto_split", "statistic": "mean", "unit": "ms", "value": 0.35078273584813247},
      {"name": "logical_min_kv_bandwidth", "scope": "auto_split", "statistic": "mean", "unit": "GB/s", "value": 607.2140109318723},
      {"name": "dram_read_throughput", "scope": "auto_split", "statistic": "mean", "unit": "%", "value": 80.32658476658477},
      {"name": "sm_active", "scope": "physical_gpu", "statistic": "mean", "unit": "%", "value": 86.34319410319411},
      {"name": "auto_split_count", "scope": "main_attention_kernel", "statistic": "observed", "unit": "splits", "value": 7},
      {"name": "main_kernel_grid_ctas", "scope": "auto_split", "statistic": "observed", "unit": "CTA", "value": 168}
    ]
  },
  "artifacts": [
    {
      "name": "summary",
      "kind": "aggregate",
      "path": {
        "root_id": "pap-worktree",
        "relative_path": "test/baseline/pap/results/runs/20260715_paged_fa_sm_probe_gpu3/summary.json"
      },
      "sha256": "bc11e66f8aa76f11dc02986376e8166b02aec3e72ec5aa21a20ae4ab3c20c3d3"
    },
    {
      "name": "full92_auto_timing",
      "kind": "metrics",
      "path": {
        "root_id": "pap-worktree",
        "relative_path": "test/baseline/pap/results/runs/20260715_paged_fa_sm_probe_gpu3/timing/full92_splits0.json"
      },
      "sha256": "644f408e6ddcde86afc38ebb24489f86529253a1d2228247ef344ff89d456d5c"
    },
    {
      "name": "full92_auto_ncu",
      "kind": "profile",
      "path": {
        "root_id": "pap-worktree",
        "relative_path": "test/baseline/pap/results/runs/20260715_paged_fa_sm_probe_gpu3/ncu/full92_splits0.ncu-rep"
      },
      "sha256": "a507c871370f7e33282b65865e853777d7a20eba5261531ac4e4f18f18bf74c1"
    }
  ],
  "validity": {"status": "passed", "reasons": []},
  "failure_reasons": []
}
